title,time,sub,comments
Flicking through old photos - any love for Blacktron 2/Rey‰Ûªs Speeder mashup?,9 hours ago,r/lego,33 comments
This is outrageous. It's unfair!,7 hours ago,r/PrequelMemes,42 comments
Nintendo Switch,7 hours ago,r/lowpoly,8 comments
u/withoutatres VS. u/beevus1445 - for stealing a screenshot and getting 9k upvotes on r/Tinder,2 hours ago,r/KarmaCourt,14 comments
Finnish ski jumping team,19 hours ago,r/NotMyJob,27 comments
[Art] Our DM secretly commissioned a group portrait for our Curse of Strahd campaign.,9 hours ago,r/DnD,28 comments
"New Mom Seeks Treatment for Her Postpartum Depression, Has the Police Called on Her Instead",3 hours ago,r/rage,13 comments
NOT SEE INGIS A FLOWER,8 hours ago,r/keming,6 comments
We didn't lose because of Gini or a lack of Coutinho,4 hours ago,r/LiverpoolFC,87 comments
Cooper: NC to sue if kept in offshore drilling plan,6 hours ago,r/NorthCarolina,30 comments
[News] iOS 11.2.5 released,2 hours ago,r/iOSBeta,37 comments
"Leafs recall Kapanen, Gauthier sent to Marlies",3 hours ago,r/leafs,96 comments
"A look back at GMA's ANIMANIA Era. No Offense, but the AnimÌ©s of my generation (late 90's - early 2000's) were the best there is",8 hours ago,r/Philippines,211 comments
You the real mvp,6 hours ago,r/Minneapolis,17 comments
At least she admits it?,5 hours ago,r/insaneparents,8 comments
Life would be a lot easier if people‰Ûªs physical appearances changed according to how good or bad they treated others.,7 hours ago,r/Showerthoughts,79 comments
"King of the jungle, probably",13 hours ago,r/noisygifs,4 comments
Kenedy has arrived,2 hours ago,r/NUFC,18 comments
"Zedd, Maren Morris & Grey - The Middle",5 hours ago,r/EDM,31 comments
comfy,4 hours ago,r/isometric,1 comment
Perth Zoo has a new red panda cub!,15 hours ago,r/redpandas,11 comments
Rebecca Yanovskaya [960x1652],11 hours ago,r/ArtPorn,1 comment
Boeing Field (BFI) with Mt. Rainer in the background,18 hours ago,r/aviation,75 comments
"Climate coalition tallied all of Trump‰Ûªs censorship of science. It‰Ûªs staggering. -- Trump's war on science threatens the nation's safety, experts warn.",17 hours ago,r/environment,57 comments
"Billionaires made enough money in 2017 to end extreme poverty around the world seven times over, report says",6 hours ago,r/justicedemocrats,2 comments
Sooo.... this just happened..... feeling a bit overwhelmed!,5 hours ago,r/batty,5 comments
"Sorry, FCC: Montana is enforcing net neutrality with new executive order",7 hours ago,r/WayOfTheBern,6 comments
Anyone else wanna be pansexual?,7 hours ago,r/Memes_Of_The_Dank,10 comments
Girlfriend mirin,4 hours ago,r/GirlsMirin,9 comments
Jeanne,4 hours ago,r/Saber,1 comment
"Sourdough with aged provolone, grilled using bacon fat (bacon not pictured).",3 hours ago,r/grilledcheese,4 comments
"Jordan Peterson's Cathy Newman Interview: Good Example Of ""Meta-Frame"" Against Feminism",5 hours ago,r/TheRedPill,65 comments
Unique view of San Jose,18 hours ago,r/bayarea,64 comments
Neon Zelda. Somewhat minimalistic,3 hours ago,r/Rainmeter,2 comments
"After being home for Christmas and then having January exams and deadlines, it's been a while!",7 hours ago,r/crossdressing,10 comments
Scream mask robber jailed for 17 years is sharing cell with his dad,11 hours ago,r/nottheonion,77 comments
Dee‰Ûªs nuts btw this was at my grocery store in 2018.,4 hours ago,r/onejob,2 comments
[Hyouka],6 hours ago,r/animenocontext,4 comments
"Before and after pic, found her while I was studying in college, she helps me study now :)",4 hours ago,r/BeforeNAfterAdoption,4 comments
"A woman standing on Omaha Beach overlooking the wrecks of several ships that were used on D-Day, 1947. [1080 X 1080]",11 hours ago,r/HistoryPorn,10 comments
Second Amendment Foundation Files Amicus Brief in Colorado Against Magazine Ban,5 hours ago,r/progun,15 comments
Crypto Expectations,4 hours ago,r/garlicoin,5 comments
Youtube's auto subtitles =),11 hours ago,r/JordanPeterson,21 comments
"I got a dip pen for my birthday, yesterday. Here is my first play with it.",5 hours ago,r/Handwriting,4 comments
My big stunner,7 hours ago,r/catbellies,1 comment
"Keep an eye out for my stupid stolen van! Taken early yesterday morning in Hamtramck. It's hard to miss, hoping someone sees it.",3 hours ago,r/Detroit,12 comments
Ink Part 3,5 hours ago,r/Hydrael_Writes,10 comments
"This Wild Drawing paint-job in Sliema, Malta 2014",9 hours ago,r/WeirdWheels,6 comments
Furry_ÙÒÊirl,6 hours ago,r/furry_irl,37 comments
One way to divide the Netherlands,9 hours ago,r/europe,80 comments
Conquering Shadow - Raymond Swanland,8 hours ago,r/ImaginaryJedi,2 comments
Pocket Camp really needs a museum,4 hours ago,r/ACPocketCamp,26 comments
DC is a hotbed of stupidity and corruption.,7 hours ago,r/hottiesfortrump,4 comments
BarÌ¤a to hold an institutional farewell ceremony for Javier Mascherano - FC Barcelona,5 hours ago,r/Barca,42 comments
Who would win?,7 hours ago,r/AdmiralBulldog,6 comments
"New to photoshop, Persona 5 x NieR: Automata crossover edit",7 hours ago,r/nier,16 comments
Omg you too?!,8 hours ago,r/Badfaketexts,20 comments
O o p s,3 hours ago,r/sbubby,9 comments
Legend from with N'Zoth Midrange/Control Hybrid Paladin with 57.4% Winrate.,5 hours ago,r/CompetitiveHS,44 comments
Wind [Original],3 hours ago,r/Moescape,1 comment
"""LOGAN"" nominated for an Academy Award for Best Adapted Screenplay",6 hours ago,r/xmen,2 comments
Raiders Emerge As Serious Contenders To Sign Bell,11 hours ago,r/fantasyfootball,74 comments
I thought this was pretty neat. For anyone who's completed a thru hike you walked 1.5 times further than Frodo and Sam did in lord of the rings,6 hours ago,r/AppalachianTrail,27 comments
New Aelves release tease?!,4 hours ago,r/ageofsigmar,101 comments
Gawls pleas3 us3 a3rosol,17 hours ago,r/dank_meme,18 comments
Mew2King lands a clutch Falcon Punch,14 hours ago,r/smashbros,58 comments
"I really hate when girls say... oh, nevermind",15 hours ago,r/Tinder,29 comments
Huuuuge,6 hours ago,r/MiniJello,5 comments
"Florida Man tattoos computer company's logo on arm, company pays to remove it.",1 hour ago,r/FloridaMan,1 comment
PIC,4 hours ago,r/nocontextpics,5 comments
Was told I should post this here! My pup Wally is the king of babushka.,5 hours ago,r/babushkadogs,2 comments
The difference time makes,7 hours ago,r/Calligraphy,5 comments
Primal Mox,4 hours ago,r/custommagic,18 comments
[244x367] Chocolaty chip cookies!,19 hours ago,r/FoodPorn,22 comments
Family Guy called it,18 hours ago,r/videos,612 comments
_Ù_¬_Ù_¬_Ù_¬Kidd Fired Upvote Party_Ù_¬_Ù_¬_Ù_¬,23 hours ago,r/MkeBucks,387 comments
One of the rare moments From BOTW.,7 hours ago,r/Breath_of_the_Wild,18 comments
Keep_track request: Trump inspired terrorists and would-be terrorists,8 hours ago,r/Keep_Track,7 comments
Former CIA Chief Wants to Keep Studying UFOs,4 hours ago,r/UFOs,23 comments
YouRiko,9 hours ago,r/LoveLive,3 comments
"Finally, after a couple months of waiting, permit upgrade was approved",6 hours ago,r/CCW,26 comments
Lil Bub's Playtime,an hour ago,r/CatSlaps,1 comment
Mrs. Potts & Chip,8 hours ago,r/ExpectationVsReality,12 comments
Reference sheet for grilling seafood,3 hours ago,r/foodhacks,2 comments
"Charlie the failed clone and brother, IRL (Color, 2018)",3 hours ago,r/FlorkofCowsOfficial,4 comments
My Novel: An Absolutely Remarkable Thing is available for pre-order. Let me know if you have any questions I might be able to answer!,3 hours ago,r/nerdfighters,161 comments
How can you be this cute doing nothing?,4 hours ago,r/ArianaGrande,3 comments
"I remember when my dog first discovered the joy of an open car window, but he has yet to try catching rain drops like this fella!",6 hours ago,r/aww_gifs,5 comments
DISCUSSION: 'Justice League' and 'Wonder Woman' failed to score any Academy Award nominations,6 hours ago,r/DC_Cinematic,228 comments
"Thanks Harry, you angered our worst enemy yet!",5 hours ago,r/FlashTV,7 comments
[Ebay/USA] $50 Nintendo Gift Card - $42.50 (15% off - IT'S BACK!),4 hours ago,r/NintendoSwitchDeals,73 comments
This guy brings me much joy! Good boye!,3 hours ago,r/germanshepherds,2 comments
Pewdiepie could learn a great deal from snoop dog,9 hours ago,r/PewdiepieSubmissions,35 comments
"ULPT: If you carry a baseball bat in your car, keep a mitt and ball in your car, too.",1 hour ago,r/UnethicalLifeProTips,10 comments
And you know this persons followers bought them,10 hours ago,r/trashy,40 comments
"What would earning $65,000 US a year, mean to you?",18 hours ago,r/AskReddit,17273 comments
Toast's Harem S1 Intro [more info inside],13 hours ago,r/offlineTV,50 comments
RED Hydrogen One - new details,7 hours ago,r/Android,122 comments
The Grand Tour Live: Richard Hammond and James May building LEGO Cars,11 hours ago,r/thegrandtour,15 comments
"THR finally uploads Full Director's Roundtable: Jolie, del Toro, Gerwig, Villeneuve, Jenkins, and Wright",5 hours ago,r/movies,159 comments
"We got Vertcoin listed on Nextexchange, now let's do the same with Cobinhood",5 hours ago,r/vertcoin,10 comments
Park zoomies,20 hours ago,r/Zoomies,56 comments
Pumped for the free weekend,7 hours ago,r/oculus,76 comments
Views from the Zoo Skyfari,2 hours ago,r/sandiego,4 comments
Some dips and pans,6 hours ago,r/PanPorn,9 comments
The last ever recorded footage of me driving a trike bike,7 hours ago,r/PUBATTLEGROUNDS,29 comments
When the beat switches in Nights,11 hours ago,r/FrankOcean,2 comments
You look nice today,20 hours ago,r/wholesomememes,14 comments
End my suffering now,10 hours ago,r/EnoughLibertarianSpam,28 comments
Davos : Emmanuel Macron se blesse au cours de la chenille cÌ©lÌ©brant la fin du Code du travail en France,9 hours ago,r/france,17 comments
New YouTube story trailer and release date. April 20th,4 hours ago,r/GodofWar,23 comments
70K subscribers!,12 hours ago,r/NEO,27 comments
Afternoon sketching by Aaron Griffin,2 hours ago,r/SympatheticMonsters,1 comment
Practical Introduction to Web Scraping in Python,3 hours ago,r/Python,2 comments
"To the guy asking ""What would you do?""",4 hours ago,r/FORTnITE,41 comments
SÌ´ gutters... Nu behÌüver I ikke brokke jer over Danmarkskortet pÌ´ Spotify lÌ_ngere,11 hours ago,r/Denmark,33 comments
Stripe discontinues accepting Bitcoin as a payment method,1 hour ago,r/Buttcoin,18 comments
"If you‰Ûªre cold, they‰Ûªre cold.",7 hours ago,r/Porsche,5 comments
I finally met Gaston. And I am so happy,3 hours ago,r/Disneyland,7 comments
Minecraft has gotten too real for me,13 hours ago,r/pyrocynical,11 comments
Fireflies in the Woods,10 hours ago,r/oddlysatisfying,18 comments
Piss off /r/xxfitness with one sentence (shamelessly stolen from /r/bodyweightfitness),2 hours ago,r/xxfitness,115 comments
Pupper beats Parvo,7 hours ago,r/rarepuppers,16 comments
Peace!,9 hours ago,r/Konosuba,1 comment
[ClutchFans] The #Clippers reportedly asked for Clint Capela in a DeAndre Jordan deal and the #Rockets shot it down.,3 hours ago,r/rockets,18 comments
Alabama residents hold candlelight vigil for Taco Bell that burned down,4 hours ago,r/tacobell,2 comments
"[TOMT][reddit post]OP mentions her roommate disappearing a few years ago after being called for dinner, another redditor tells her the roommate has been found dead.",8 hours ago,r/tipofmytongue,21 comments
What Makes Me Happy?,6 hours ago,r/Izlam,4 comments
ZoO kEePeR bRuTaLlY mAuLed To DeAtH bY a HiPpO,10 hours ago,r/PeopleFuckingDying,7 comments
How To Cockatiel,3 hours ago,r/cockatiel,3 comments
"ETH was going up, now it's going down",7 hours ago,r/ethtrader,89 comments
drew an overlay instead of sleeping,10 hours ago,r/northernlion,25 comments
"Passed Level 1, but it is very special",5 hours ago,r/CFA,23 comments
Nintendo's HQ a century ago,4 hours ago,r/gaming,22 comments
How to increase cigarette sales by advertising to chickens,6 hours ago,r/disneyvacation,16 comments
A banana out of a blonde sleeve,4 hours ago,r/starbucks,2 comments
Atlas the Terminator,2 hours ago,r/samoyeds,comment
"When you don't want the nice man pruning your trees to see what a lazy, depressed slug you are in bed, under your covers.",5 hours ago,r/TrollCoping,5 comments
"I'm sorry Phil, but I thought my friends PUBG character looked like you. I call him Phil everytime we play now.",20 hours ago,r/xboxone,165 comments
Happy 24th Birthday to Addison Russell!,5 hours ago,r/CHICubs,10 comments
Henrik says ‰ÛÏmoney won‰Ûªt matter‰Û when it comes to whether or not to a sign a new contract at end of season.,1 hour ago,r/canucks,22 comments
The Map of Physics,2 hours ago,r/Infographics,2 comments
Rum French Toast from Mad Men,6 hours ago,r/bingingwithbabish,13 comments
Florida wigglebutts love their hammocks,5 hours ago,r/WiggleButts,3 comments
"Hounslow's Corner, Broad and Minster Streets, Reading, England, demolished 1909.",7 hours ago,r/Lost_Architecture,2 comments
Vietnam has made it to the Finals AFCU23! Let's gooooo!!,9 hours ago,r/VietNam,39 comments
Review Coming Soon (Hivi T200C),4 hours ago,r/audiophile,14 comments
[35/f] My husband (32/m) had an incestuous relationship with his sister. I'm disturbed.,2 hours ago,r/relationship_advice,76 comments
Tfw there‰Ûªs no new Dragula tonight,1 hour ago,r/Dragula,5 comments
Philadelphia Eagles fans get into a brawl during the tailgate before the Vikings game,9 hours ago,r/PublicFreakout,195 comments
Spotted outside a Games Workshop,9 hours ago,r/justneckbeardthings,37 comments
What is the correlation between these mathematicians and the volume of water?,2 hours ago,r/math,21 comments
AAP Demands Disqualification of 116 BJP MLAs in MP for Holding Office of Profit,10 hours ago,r/india,78 comments
It seems that our One True God is a part of the Star Wars expanded universe.,4 hours ago,r/onetruegod,3 comments
I printed and painted a dice tower for tabletop gaming,3 hours ago,r/3Dprinting,8 comments
Star Wars: The Last Jedi receives 4 Oscar nominations.,6 hours ago,r/StarWars,286 comments
Thread overflow,2 hours ago,r/glitch_art,2 comments
When your former team is on a 10 game winning streak and they attribute it to you being traded.,15 hours ago,r/nhl,13 comments
Maybe he's born with it,17 hours ago,r/freefolk,19 comments
Long-term investment into Gwent,6 hours ago,r/gwent,44 comments
Collecting Clams,7 hours ago,r/splatoon,12 comments
Gregg reunites with his best friend Mae (from /r/eyebleach),6 hours ago,r/NightInTheWoods,5 comments
hmmm,8 hours ago,r/PurpleCoco,7 comments
Excellent,9 hours ago,r/OffensiveMemes,6 comments
"I just started reading Discworld. I'm about 1/4 into The Light Fantastic...The Luggage, Jesup Christ The Luggage gets me every time.",7 hours ago,r/discworld,14 comments
Unexpected wholesome dad on an entertainment news article!,4 hours ago,r/oldpeoplefacebook,4 comments
Jefe the Gato in a sink being not at all creepy.,4 hours ago,r/CatsInSinks,3 comments
Got to a solid [7] last night and was playing around with the panoramic function.,6 hours ago,r/woahdude,14 comments
Force India to be renamed to FORCE Formula One Team,7 hours ago,r/formula1,155 comments
[Haiku] Sick Vape Trick,16 hours ago,r/youtubehaiku,12 comments
[Orient] Sun & Moon,7 hours ago,r/Watches,13 comments
Canada and rest of TPP countries agree to revised text: reports | CBC News,7 hours ago,r/CanadaPolitics,75 comments
Lets never forget the best magic show ever broadcast on Twitch,13 hours ago,r/loltyler1,9 comments
"The data from LIGO's first observing run (O1) is now available from the LIGO Open Science Center. This data includes GW150914, LVT151012 and GW151226.",4 hours ago,r/Physics,2 comments
Big Mlem,9 hours ago,r/pics,70 comments
Sequoia Cruisin' from the cockpit of my 2017 M3,11 hours ago,r/BMW,59 comments
I just bought a case of dynamite. It was an offer I couldn't re-fuse.,7 hours ago,r/dadjokes,11 comments
Full Circle,7 hours ago,r/starwarsrebels,14 comments
Unlucky Witch by Anna Helme (xpost r/ImaginaryPets),6 hours ago,r/ReasonableFantasy,3 comments
creepyasterisks and whiteknighting wombo combo,9 hours ago,r/creepyasterisks,10 comments
It's Tzusday my dudes (Tzuyu),5 hours ago,r/kpics,2 comments
"Gorillaz The Eel original storyboard Page 1, 2 and 5",2 hours ago,r/gorillaz,11 comments
Courtesy of my hockey team‰Ûªs group chat (this is exactly as it was sent),5 hours ago,r/comedyhomicide,8 comments
One of my favourite routes in the UK. Crib Goch :),5 hours ago,r/hiking,10 comments
Sessions interviewed by Mueller team in Russia investigation,5 hours ago,r/RussiaLago,7 comments
RPCS3 2017 Wrap-up: A Stunning Year of Progress,3 hours ago,r/linux_gaming,1 comment
"Quebec MP: ""Weed bought in Quebec needs to be grown in Quebec""",4 hours ago,r/weedstocks,97 comments
Turns out AB+ isn't always all that selfish,,r/coolguides,174 comments
She scoots while she sploots,3 hours ago,r/sploot,1 comment
NFL rejects veteran groups ad which included the hashtag ‰ÛÏ#PleaseStand‰Û. Thoughts?,5 hours ago,r/AskThe_Donald,56 comments
"[Duane Rollins] ""So @CyleLarin says he‰Ûªs not under contract with @OrlandoCitySC and that he‰Ûªs signed with @Besiktas. I suspect he‰Ûªs challenging the legality of the club options that MLS forces onto most contracts. I also suspect @MLSPlayersUnion is cheering him on.""",4 hours ago,r/MLS,117 comments
"Other than Sanderson, who does great rules-based magic Fantasy?",6 hours ago,r/Fantasy,124 comments
Ukrainian quad RPG tripod mount,2 hours ago,r/Military,17 comments
[High Gain Test Series - 20s subs] NGC5128 Centaurus A.,6 hours ago,r/astrophotography,7 comments
_ÙÓ´This Blood Soaked Lioness Is Fucking Straight _ÙÓ´,2 hours ago,r/NatureIsFuckingLit,4 comments
"""You have to be willing to lose your life in order to find it"" -Jordan B. Peterson",5 hours ago,r/quotes,8 comments
Cobweb gun,12 hours ago,r/specializedtools,37 comments
"She's taking over and thinks she's helping, but she's unintentionally depicted attacking a white blood cell, hurting his immune system - doing more harm than good. In that context, I feel like this belongs here.",5 hours ago,r/JUSTNOFAMILY,1 comment
Old but even more relevant a year later,1 hour ago,r/PoliticalHumor,5 comments
Lixeirinha da Heinneken - fiz com lata de chopp,6 hours ago,r/brasil,34 comments
Down 100 pounds in 5 months _Ù_÷_Ù_÷,3 hours ago,r/keto,61 comments
"Jewdicus, master in the arts of Jew-Jitsu",5 hours ago,r/Bossfight,2 comments
"Good morning, I am floof",7 hours ago,r/puppies,2 comments
"My Dad takes Ambien and sometimes eats in his sleep, aND THEN THIS MORNING,",5 hours ago,r/LushCosmetics,31 comments
I don't want to be touched!,4 hours ago,r/StopTouchingMe,1 comment
Meghan is officially leaving RHOC,an hour ago,r/BravoRealHousewives,52 comments
Got to pick my own hardhat for work!,5 hours ago,r/GreenBayPackers,2 comments
30 year old F-84 built by the inventor of Bare-Metal Foil still looks great.,9 hours ago,r/modelmakers,1 comment
When you‰Ûªre a Breton mage that runs out of Magicka midfight,9 hours ago,r/TrueSTL,2 comments
Alfred Hitchcock found an interesting way to show a boxer's career progressing through the changing seasons in The Ring (1927),2 hours ago,r/silentmoviegifs,1 comment
My username,3 hours ago,r/exjw,54 comments
Brave browser version 0.20.x is 97% complete! Only 13 open issues left.,7 hours ago,r/BATProject,18 comments
Shinobu in terraria!,5 hours ago,r/araragi,3 comments
When you‰Ûªre about to win and you realize that you have a 7 hour drive back to school right after,2 hours ago,r/hockeyplayers,11 comments
Had to do a double take on this (seen on r/Ireland),11 hours ago,r/tombstoning,4 comments
This artwork belongs here.,2 hours ago,r/cyberpunkgame,2 comments
Matic is now on Instagram!,6 hours ago,r/reddevils,20 comments
[Megathread] Pat Shurmur announced as the new Head Coach for the New York Giants,5 hours ago,r/NYGiants,38 comments
TEN IN A ROW UPVOTE PARTY!!! GET IN HERE!,17 hours ago,r/ColoradoAvalanche,225 comments
The land of meat and two veg.,4 hours ago,r/wildlypenis,1 comment
White Wolf making a big comeback?,6 hours ago,r/rpg,88 comments
Timbers Reveal New White Secondary Kit,3 hours ago,r/timbers,33 comments
Got told my cancer and husbands brain injury were because I am an Atheist!!,3 hours ago,r/TheFacebookDelusion,15 comments
Appropriately suspicious email,4 hours ago,r/suspiciousquotes,3 comments
Binance has enabled the use of batch payments API and reports no withdrawal backlog of Ada. It is currently working...,6 hours ago,r/cardano,28 comments
Healed navel by Joe at Amato switched for this Leroi piece!,6 hours ago,r/piercing,6 comments
me irl,4 hours ago,r/metal_me_irl,2 comments
Boy genius,17 hours ago,r/MadeMeSmile,12 comments
Akodo Dairuko by Diego Gisbert Llorens,6 hours ago,r/armoredwomen,1 comment
Strip Ending Bitcoin Support,an hour ago,r/Bitcoin,64 comments
[Media] Rem&Ram,2 hours ago,r/Re_Zero,1 comment
Miami's Michael Thomas is the PFF NFL Special Teams Player of the Year,2 hours ago,r/miamidolphins,9 comments
"Oklahoma State WR James Washington said it would be a dream come true to play for the Cowboys, his favorite team growing up. Said he'd be a great complement to Dez Bryant. Said he often studied his tape while at Oklahoma State. He said Dez needs help.",2 hours ago,r/cowboys,22 comments
"Warum es mir schwer fÌ_llt, den Ì¦sterreichischen Handel zu unterstÌ_tzen.",10 hours ago,r/Austria,111 comments
_ÙÎ¼ flower _Ù_Û pony _ÙÎ¼,9 hours ago,r/Greyhounds,comment
Hippo Smash,15 hours ago,r/reallifedoodles,14 comments
Who was the highest rated recruit to sign with an FCS school out of high school?,6 hours ago,r/CFB,213 comments
Mike Novogratz building on EOS! BULLISH,3 hours ago,r/eos,43 comments
Murphy Orders Broader Access to New Jersey‰Ûªs Medical-Marijuana Program,2 hours ago,r/newjersey,6 comments
[Case] Corsair 400C Mid-Tower Case $79.99 [$99.99-$20]with promo,8 hours ago,r/buildapcsales,39 comments
He knows..,5 hours ago,r/RoughRomanMemes,2 comments
Bugatti Type 55 - 1932,8 hours ago,r/classiccars,2 comments
"County commissioner writes post calling women's marchers ""dumass"", deletes it and says he left his iPad unlocked",4 hours ago,r/OopsDidntMeanTo,8 comments
"PSA: Don't punish your DM for saying ""yes""",20 hours ago,r/dndnext,104 comments
Twintails Reimu,10 hours ago,r/touhou,11 comments
The IOC views the Saddledome as acceptable for Olympic hockey and figure skating,59 minutes ago,r/Calgary,22 comments
10/10 would buy,9 hours ago,r/antimeme,4 comments
How to Fillet a Big Salmon and Prepare it for Smoked Salmon Recipe,15 hours ago,r/ArtisanVideos,24 comments
"Just saw this, is it new ? Any value ?",7 hours ago,r/MemeEconomy,19 comments
Randomly went onto street view in Larne for the craic and saw this,6 hours ago,r/northernireland,18 comments
I felt so dirty after this kill,4 hours ago,r/GhostRecon,11 comments
Big Mlem,9 hours ago,r/pics,70 comments
Dreaming of summer days,3 hours ago,r/longboarding,comment
Valley of Giants by Biagio D'alessandro,11 hours ago,r/ImaginaryBehemoths,3 comments
De spelregels van de sleepwet worden nu al overtreden,9 hours ago,r/thenetherlands,81 comments
"Pixar are good. Khan Academy are good. I just found a course on Khan Academy, by Pixar, on the subject of storytelling. This looks promising!",19 hours ago,r/writing,78 comments
[I ate] veggie-filled rice paper rolls,7 hours ago,r/food,37 comments
Jullie ook altijd?,3 hours ago,r/cirkeltrek,4 comments
Botanist's House by Gabriel Nagypal,6 hours ago,r/ImaginaryInteriors,3 comments
Does anyone here make a decent living off their own e-commerce store or Amazon?,8 hours ago,r/Entrepreneur,116 comments
Restaurant Gets A New And Unexpected Water Feature,11 hours ago,r/TalesFromTheFrontDesk,17 comments
Dosar penal in cazul jandarmului care a lovit protestatari cu pumnul.,6 hours ago,r/Romania,8 comments
"in real time, my shiba inus fighting seems vicious but in slo-mo (4k) you can see that they are actually playing according to a choreographed routine.",4 hours ago,r/shiba,6 comments
Ice storm conditions,9 hours ago,r/ottawa,94 comments
Normies REEEEEEEEEEEEEEE,5 hours ago,r/uwaterloo,35 comments
Congrats to Greta Gerwig and her film for their Oscar nominations!,5 hours ago,r/Sacramento,5 comments
Does anyone remember Amber on The Facts of Life??,7 hours ago,r/TeenMomOGandTeenMom2,18 comments
Just over $3 an hour! Who could resist?,5 hours ago,r/ChoosingBeggars,29 comments
Canada signs on to revised Trans-Pacific Partnership,7 hours ago,r/canada,218 comments
"At your service, if she HAS to. [Love Live!]",4 hours ago,r/Tsunderes,2 comments
3 weeks in 12l nano tank,8 hours ago,r/PlantedTank,14 comments
Efter-skolan klassiker,5 hours ago,r/sweden,16 comments
"I‰Ûªm entrepreneur Daymond John. I‰Ûªm a Shark on ABC‰Ûªs Shark Tank, a Pisces, a Hot Sauce connoisseur, and an animal advocate. Today I‰Ûªm talking about how you can RISE AND GRIND. Ask me anything!",23 hours ago,r/IAmA,1814 comments
Fresh bowl of northern lights before bed,5 hours ago,r/weed,7 comments
Psychiatrist said I don't fit criteria for gender dysphoria. Now what?,4 hours ago,r/asktransgender,53 comments
Making an encounter for a Saturday game,2 hours ago,r/dndmemes,3 comments
The Punisher,8 hours ago,r/DestinyFashion,9 comments
She‰Ûªll never have another 1989 era...,3 hours ago,r/TaylorSwift,29 comments
Cursed_store,5 hours ago,r/cursedimages,comment
Justin Forsett will be on Shark Tank this week,3 hours ago,r/ravens,9 comments
"Found It! That time where Brady doorknobs Jimmy G's fistbump! (Brady's 400th career TD, Oct 2015)",3 hours ago,r/Patriots,19 comments
