title,time,sub,comments
Molly Eskam (@mollyeskam),9 hours ago,r/InternetStars,1 comment
Normal Day,10 hours ago,r/Cyberpunk,6 comments
Actual picture of me calling to save Shane J when he's nominated,10 minutes ago,r/bbuk,20 comments
EVERY MAN A FORMER KGB AGENT,1 hour ago,r/Kaiserreich,comment
MapleStory M English Beta Launched,4 hours ago,r/AndroidGaming,17 comments
What Cathy Newman thinks he tells us to do,9 hours ago,r/Jordan_Peterson_Memes,3 comments
"Heartbreaker monster... Chocolate cake, milk chocolate ganache and dark chocolate ganache - dÌ©corations : elastic chocolate and meringue",4 hours ago,r/Baking,3 comments
Flat dark earth wasn't hyve's best description,4 hours ago,r/Glocks,23 comments
"ANOTHER Hate Crime Hoax Perpetrated By BLACK Students, Blamed on White Students at University of Maryland",6 hours ago,r/uncensorednews,11 comments
"[2048x2048] Pulled 3 signed books out of Goodwill yesterday. 40th Ann. Ed. Fahrenheit 451 by Ray Bradbury, End Game by James Frey & White Jazz by James Ellroy.",8 hours ago,r/bookporn,5 comments
Daenerys: Mother of Dragons by Daniel Kordek,7 hours ago,r/ImaginaryWesteros,1 comment
Twitter COO resigns.,4 hours ago,r/greatawakening,6 comments
"""Why won't people touch me""",8 hours ago,r/HotPaper,2 comments
Anime. Upvote this so that it shows up when someone googles 'Anime'.,12 hours ago,r/fnki,2 comments
Bill to require cursive writing passes Indiana Senate,6 hours ago,r/Indiana,30 comments
JONY TEST,4 hours ago,r/nukedmemes,1 comment
A cold sunrise at Tangle Peak - Jasper National Park (OC)[1335x2000],4 hours ago,r/EarthPorn,1 comment
queen of yawning,7 hours ago,r/bernesemountaindogs,1 comment
Quality meme,4 hours ago,r/starwarsmemes,comment
Curb Your Womanhood,5 hours ago,r/MemeYourEnthusiasm,6 comments
/r/winnipeg - Now With 100% Less JoeESP!,4 hours ago,r/Winnipeg,181 comments
My tiny N. tentaculata is starting to show its characteristic oval mouth,7 hours ago,r/SavageGarden,3 comments
UNLIMITED POWEEEER,3 hours ago,r/BattlefrontTWO,comment
It's ok,3 hours ago,r/Unextexted,comment
Ronaldo in training,6 hours ago,r/realmadrid,10 comments
Father beats up babysitter after finding him (the babysitter) sexually abusing his 11 year old son.,9 hours ago,r/JusticeServed,19 comments
"Anyone else a huge fan of ""Untitled"" (the song)?",3 hours ago,r/Blink182,10 comments
[Art] Crow Skin Idea ‰ÛÏPhoenix Crow‰Û,4 hours ago,r/Brawlstars,16 comments
Bitmain is buying 20k 16nm wafers from TSMC per month (more than NVIDIA),8 hours ago,r/nvidia,86 comments
Be careful out there today. It's January.,6 hours ago,r/Justrolledintotheshop,27 comments
How I Lost Nearly 200 BTC trading this past month,23 hours ago,r/BitcoinMarkets,902 comments
"The-Eye Addresses u/iamjoshybear, Content Complaints, New Content & Top 10 Files.",41 minutes ago,r/opendirectories,2 comments
Splatoon on GBA,7 hours ago,r/Gameboy,8 comments
Key posts short clip of him working with Jonghyun on ‰ÛÏDon‰Ûªt Stop‰Û,6 hours ago,r/SHINee,13 comments
Xbox Game Pass Expands To Include New Releases From Microsoft Studios,5 hours ago,r/xbox,27 comments
Paavo vs Matti,7 hours ago,r/Suomi,12 comments
IT'S OFFICIAL!!! OSL 2018 - AUGUST 10-12 2018!,2 hours ago,r/OutsideLands,12 comments
Mimicking the human voice with fretless bass.,3 hours ago,r/Bass,7 comments
I made a spotify playlist of all the music played by Porter during Virtual Self shows,4 hours ago,r/porterrobinson,3 comments
Cocktus,6 hours ago,r/mildlypenis,4 comments
"""T-Mobile Completes Acquisition of Layer3 TV, Preps TV Service""",4 hours ago,r/tmobile,46 comments
"Sweet, spicy, smoky margarita",5 hours ago,r/cocktails,20 comments
I farted,17 hours ago,r/MildlyStartledCats,7 comments
Bike stunt almost results in certain death,2 hours ago,r/nonononoyes,10 comments
Congrats to AMD_Robert on a job well done,14 hours ago,r/Amd,37 comments
"Louisiana is still losing their goddamn mind over Tom Segura's new special ""Disgraceful""",an hour ago,r/StandUpComedy,38 comments
Steve Wilks walking down the beach towards Keim like..,4 hours ago,r/AZCardinals,8 comments
Glare - 3.6 - Parahumans 2,13 hours ago,r/Parahumans,366 comments
Oily,12 hours ago,r/SommerRay,3 comments
"Redditor fakes condition and uses a solder iron to write on his skin, for some of that hot karma _ÙÓ´",9 hours ago,r/KarmaConspiracy,6 comments
Was the U.S. Civil War considered to be major world news at the time? How likely would it have been for an average European citizen to be aware of what was happening in the U.S.?,10 hours ago,r/AskHistorians,3 comments
Rails along the pacific coast highway [OC],2 hours ago,r/rustyrails,2 comments
Green bikini cleavage,1 hour ago,r/KellyBrook,comment
When you're bored...,11 hours ago,r/Vaporwave,17 comments
What‰Ûªs wrong with being ugly? I didn‰Ûªt choose to be.,3 hours ago,r/TrueOffMyChest,11 comments
Congrats to SNL alumni Laurie Metcalf for being nominated for the Best Supporting Actress at this year's Academy Awards,6 hours ago,r/LiveFromNewYork,26 comments
Jesus Christ I'm tired of these,11 hours ago,r/ExpandDong,10 comments
My flag and I made it into Avenged's Ottawa post!,3 hours ago,r/avengedsevenfold,8 comments
"THE BOWL THAT WAS PROMISED IS COMING IN JUST ONE YEAR, CUNTS",3 hours ago,r/cleganebowl,1 comment
"Meryl Streep in rainy New York City, 1979",5 hours ago,r/OldSchoolCelebs,1 comment
Photo I took in November of the festival center.,5 hours ago,r/WaltDisneyWorld,3 comments
"Give a man a fire, and he'll be warm for a day...",1 hour ago,r/MeanJokes,3 comments
What cool shit do you have that girls like to take pictures in front of?,3 hours ago,r/Frat,20 comments
"Overlord II Episode 3 ‰ÛÒ Lizard men, gathering (Links and Discussion)",4 hours ago,r/overlord,70 comments
Cardio? Ngannou do it,22 hours ago,r/ufc,54 comments
Does anyone else think that Woody Flowers is basically some sort of Lawful Good alternate universe version of Revolver Ocelot?,4 hours ago,r/FRC,2 comments
I think he‰Ûªs going through a ‰ÛÏmine‰Û phase,6 hours ago,r/pitbulls,4 comments
First look at issue #178,12 hours ago,r/thewalkingdead,36 comments
Lion zentangle,5 hours ago,r/learnart,6 comments
ULPT: work at a hotel and want free drugs? Just snoop through guest rooms when they‰Ûªre not there and take if you find any. No one is reporting lost drugs,4 hours ago,r/UnethicalLifeProTips,11 comments
"Mr. Carmack, Kenny Segal, Mike Parvizi (The Jefferson Park Boys) - Casual Horns, Dog",3 hours ago,r/trap,3 comments
[Bill Michaels] Inside info on how everything went down yesterday,an hour ago,r/MkeBucks,28 comments
me irl,5 hours ago,r/lucifer,3 comments
Tsunami Watch issued at 11:43pm - Magnitude 8 Earthquake in the Gulf of Alaska,10 hours ago,r/Hawaii,69 comments
Assange team hopes UK could declare him persona non grata,7 hours ago,r/WikiLeaks,11 comments
Your reminder of who the last team to beat New England in the playoffs was.,3 hours ago,r/DenverBroncos,4 comments
‰ÛÏI‰Ûªm sorry I‰Ûªm late. My ferrets hid my shoes in two different places.‰Û,5 hours ago,r/ferrets,4 comments
Alex singing Last Nite by The Strokes at Tom Rowley's wedding,10 hours ago,r/arcticmonkeys,5 comments
Choking Victim - Crack Rock Steady,6 hours ago,r/Ska,2 comments
Went from a ‰Û÷97 M edition to a ‰Û÷16 MX5 Club. Such a beauty,7 hours ago,r/Miata,18 comments
I got exactly 1 Million points on Riven. Feelsgoodman.,4 hours ago,r/Rivenmains,17 comments
In Honor Of Our Allies -- Kangaroo Officer Makes Heroic Last Stand Against Overwhelming Odds,5 hours ago,r/Emuwarflashbacks,2 comments
"[RF] Julaara Greenmane, Monk of the Order of Unity",2 hours ago,r/characterdrawing,1 comment
How Japan Combos Samus,4 hours ago,r/smashgifs,1 comment
"My ""Ahri"" Keycaps Mechanical Keyboard",4 hours ago,r/AhriMains,8 comments
"Oklahoma among nation‰Ûªs least-educated states, study says (crosspost /r/OklahomaPolitics)",1 hour ago,r/oklahoma,4 comments
Tyler1 showing how much he cares about viewer count,3 hours ago,r/LivestreamFail,43 comments
Six Storygame Mechanics for D&D,12 hours ago,r/UnearthedArcana,12 comments
Low Calorie milkshake,18 hours ago,r/shittyfoodporn,60 comments
Saw a familiar painting at the David Hockney exhibit this weekend!,5 hours ago,r/BoJackHorseman,4 comments
Tommy Pham on Hot Stove this morning,4 hours ago,r/Cardinals,11 comments
Pumped for the free weekend,7 hours ago,r/oculus,79 comments
"Grrvana - ""Nevermind""",10 hours ago,r/fakealbumcovers,6 comments
Setup - second version [day],8 hours ago,r/battlestations,20 comments
Concorde in NYC 1990,10 hours ago,r/aviation,7 comments
N-NANI?!?!?,17 hours ago,r/masterforgiveme,10 comments
Europe‰Ûªs central banks are starting to replace dollar reserves with the yuan,9 hours ago,r/Economics,19 comments
"Jauan Jennings isn't back on team but has avenue to return, Fulmer says",4 hours ago,r/ockytop,11 comments
"The Temple of Artemis at Ephesus was one of the seven wonders of the Ancient World and The Temple was made entirely of marble. [""Beautiful Artemis Statue"" in Ephesus Museum]",2 hours ago,r/Archaeology,1 comment
Lab work,5 hours ago,r/physicsmemes,comment
A smartphone app that lets parents track their child‰Ûªs whereabouts and listen in on them.,10 hours ago,r/ABoringDystopia,33 comments
Everyday i see people like this that don't want to wait,3 hours ago,r/PeopleBeingJerks,12 comments
Short North Retailer 'Pursuit' Will Outfit USA Men‰Ûªs Curling Team for 2018 Winter Olympics,1 hour ago,r/Columbus,2 comments
"Even though he‰Ûªs not the Lions coach yet, Matt Patricia has told some Lions assistants they won‰Ûªt be back",6 hours ago,r/detroitlions,39 comments
"With Valentine's Day coming up, remind your SO that they are that special person in your life with this little reminder...",2 hours ago,r/MST3K,1 comment
Agregaron Al Uganda Knuckles A Mundo Gaturro...,8 hours ago,r/argentina,110 comments
I really hope this is satire.,9 hours ago,r/insanepeoplefacebook,52 comments
One of these is not like the others...,14 hours ago,r/German,18 comments
"Child killed at German school, reportedly murdered by schoolmate",8 hours ago,r/germany,13 comments
Danielle DeNicola,16 hours ago,r/geekygirls,7 comments
Happy tail light Tuesday,4 hours ago,r/Mustang,3 comments
My little win,6 hours ago,r/ZeroWaste,5 comments
"Found MArge in George Town, Penang",6 hours ago,r/streetart,comment
I want to play a game.,4 hours ago,r/dvdcollection,6 comments
Bill Watterson drawing of Paige from Foxtrot,5 hours ago,r/calvinandhobbes,2 comments
Root beer spill on laptop and took the keyboard with it. Power button is on the keyboard :/,15 hours ago,r/techsupportmacgyver,14 comments
We got r/Europe,9 hours ago,r/finlandConspiracy,2 comments
I see your Drippy Dan and raise you a Juicy Jess!,5 hours ago,r/trypophobia,4 comments
Comparison of Vanilla and DLC Heros,7 hours ago,r/forhonor,62 comments
_ÙÉ±•üheese tou_ÙÉ±•üh,10 hours ago,r/DeepFriedMemes,14 comments
The 'Call Me By Your Name' Spring/Summer Style Guide,4 hours ago,r/malefashionadvice,9 comments
I can't believe that in just 12 weeks this tiny yappy goober has turned into a beautiful lady goober four times the size.,6 hours ago,r/BorderCollie,2 comments
"The 49ers are 2nd on Bleacher Report's list of ""Which NFL Teams Are Ready to Make the Leap in 2018 After Failed 2017 Seasons?""",an hour ago,r/49ers,6 comments
[ALL] Kyle MacLachlan on Stephen Colbert this Friday,2 hours ago,r/twinpeaks,2 comments
Can you spot S.T.A.L.K.E.R in this picture?,4 hours ago,r/stalker,28 comments
"Husband left the glass door open to the entertainment center, then promptly walked thru it.",9 hours ago,r/Wellthatsucks,13 comments
Oregon senators vote against reopening government without protections to 'Dreamers',6 hours ago,r/oregon,28 comments
Girl posted this gem on her snap story,7 hours ago,r/creepyPMs,15 comments
"This counts, yes?",5 hours ago,r/gatekeeping,5 comments
"Muttontown Preserve Ruins Documentary (2011) - A short documentary on the Muttontown Preserve ruins, once the property of the last monarch of Albania. Now a nature preserve.",5 hours ago,r/Documentaries,3 comments
Speed reading.,6 hours ago,r/educationalgifs,10 comments
"Came across this beautiful memorial at 60ft in St. Thomas, U.S. Virgin Islands. What a place to rest in peace. Here's to Mr. Letts!",3 hours ago,r/scuba,10 comments
"Jonathan Ha to present Red Pulse at the World Economic Forum - January 24, 16:15-16:30 CET - A new Research Ecosystem for China",5 hours ago,r/RedPulseToken,18 comments
Republicans Have Four Easy Ways to #ReleasetheMemo ‰ÛÓ and the Evidence For it. Not Doing So Will Prove Them to Be Shameless Frauds.,1 hour ago,r/WayOfTheBern,3 comments
The OG forbidden snack,7 hours ago,r/forbiddensnacks,5 comments
Antigo jornal do 25 de abril [OC],5 hours ago,r/portugal,28 comments
Fantastic response to a miserable tourist. (Although why is the Pot Still listed as a restaurant in Tripadvisor?),4 hours ago,r/glasgow,9 comments
"Half Glock, Full Mall Ninja",21 hours ago,r/mallninjashit,58 comments
Mystery thing needs identifying.,3 hours ago,r/whatisthisthing,12 comments
Consolation,2 hours ago,r/FunnyandSad,comment
I'm happy because you people are chill.,3 hours ago,r/ElectricForest,12 comments
I work as an Ableton Playback Engineer and I created a timelapse of a typical day during Logic's Everybody Tour. Hope you enjoy!,2 hours ago,r/ableton,9 comments
"The latest fashions of the Roaring Twenties, brought to you in very early Technicolor filming (1927)",8 hours ago,r/ObscureMedia,1 comment
Check out this cool ‰ÛÏFrasierwave‰Û artwork I found,an hour ago,r/Frasier,1 comment
Holo and a apple,2 hours ago,r/SpiceandWolf,1 comment
OH MY GOSH HULU WHAT,20 hours ago,r/stevenuniverse,94 comments
Orange Juice,4 hours ago,r/GalinaDubenenko,1 comment
Michigan bakery sells 600-plus Flamin' Hot Cheetos doughnuts in 2 hours,7 hours ago,r/Michigan,14 comments
Kudos BPT,19 hours ago,r/CringeAnarchy,316 comments
Trump Taxes Solar Imports in Biggest Blow to Renewables Yet,22 hours ago,r/Futurology,2508 comments
"Made my first garlic bread today, looks good.",2 hours ago,r/GarlicBreadMemes,3 comments
Hey guys check out my CRAAAAZY Cabalist's Tome! Give me karma!,3 hours ago,r/hearthstonecirclejerk,4 comments
The penis mightier than the sword,22 hours ago,r/CrappyDesign,259 comments
Trammel of Archimedes,17 hours ago,r/visualizedmath,18 comments
Wish I had found this sub sooner! T minus 52 days till I get to meet this beautiful boy!,3 hours ago,r/predaddit,2 comments
Tucson Unified School District kept a secret blacklist for decades. A reporter found it,2 hours ago,r/Tucson,3 comments
Fun Fact about First Evictions,6 hours ago,r/BigBrother,13 comments
Manchester City are in negotiations with Athletic Bilbao this afternoon over a deal for Aymeric Laporte. [Sky Sports News],4 hours ago,r/MCFC,28 comments
"Connecting the Norwegian coastal cities by road, a daunting project coming ever closer to reality (commentary in norwegian).",6 hours ago,r/EngineeringPorn,6 comments
Hawaii Missile Alert Update Delayed Because Governor Didn‰Ûªt Know His Twitter Password,8 hours ago,r/NewsOfTheStupid,4 comments
Best of the Worst: Plinketto #5,16 hours ago,r/RedLetterMedia,87 comments
"Like some other cotingids, the å¢ock-of-the-rock has a complex courtship behavior, performing impressive lek (Swedish for play) displays!",1 hour ago,r/Awwducational,6 comments
"Found (what I assume is) a beautiful hawk moth in Brisbane, Australia. Anyone able to help identify it further than Sphingidae family?",11 hours ago,r/whatsthisbug,7 comments
Women literally just want one thing and it's fucking disgusting,7 hours ago,r/Tinder,15 comments
RLCS Roster Lock Info,an hour ago,r/RocketLeagueEsports,3 comments
Washed up on the shore,11 hours ago,r/megalophobia,6 comments
Basically the entire debate,4 hours ago,r/JordanPeterson,6 comments
Purrkour,22 minutes ago,r/CatsISUOTTATFO,2 comments
Free Daily Card,5 hours ago,r/duelyst,8 comments
"‰ÛÏThe Insult‰Û Is Nominated For Best Foreign Film Oscar, First Time Ever For A Lebanese Movie",6 hours ago,r/lebanon,6 comments
Measure 101: Don‰Ûªt forget to vote!,2 hours ago,r/Portland,11 comments
Tesla Announces New Long-Term Performance Award for Elon Musk,11 hours ago,r/teslamotors,137 comments
"I guess if she was going for the ‰ÛÏpunched in the face‰Û look, she nailed it",4 hours ago,r/crappycontouring,3 comments
"So uh, Alaskans... How you doing?",9 hours ago,r/AskAnAmerican,36 comments
Vote for XRB to be reviewed.,7 hours ago,r/RaiTrade,14 comments
No need to shovel the driveway when you have a 4Runner. It'll melt eventually anyways.,4 hours ago,r/4Runner,3 comments
"[shitpost] Nanites , courtesy of Ray Palmer.",8 hours ago,r/FlashTV,6 comments
Willow looks straight into the camera as she struts,6 hours ago,r/SupermodelCats,comment
Oliver Chubbs,7 hours ago,r/Chihuahua,1 comment
My project car,3 hours ago,r/battlewagon,comment
werner ate the cheese,2 hours ago,r/Cuphead,1 comment
Taissa farminga,8 hours ago,r/CelebrityFeet,comment
"Never forget that time in 2016 I bumped into Pewds, Jack and Mark in one go. Whoops",10 hours ago,r/Markiplier,5 comments
Kurt Busch says Ford will have new body in 2019,5 hours ago,r/NASCAR,62 comments
Juolevi snipes one top shelf off an assist from Palmu,3 hours ago,r/canucks,12 comments
Be careful with those rods in your mouth!,5 hours ago,r/flyfishing,14 comments
Dodgers Can Replace Yu Darvish with Flamethrowing No. 1 Prospect Walker Buehler,2 hours ago,r/Dodgers,10 comments
Birds,3 hours ago,r/WhitePeopleTwitter,4 comments
"Jeff, how is that clock coming?",6 hours ago,r/Anarchism,5 comments
"My mother used to beat me with a camera, I still have flashbacks.",4 hours ago,r/oneliners,2 comments
Sweet baby duck,6 hours ago,r/babyduckgifs,2 comments
Mood. Fly Eagles Fly _Ù_É,7 hours ago,r/eagles,15 comments
"Family of Man Killed by Police after 'Swatting' Prank Sues City, Police Officers [1/23/18]",2 hours ago,r/Bad_Cop_No_Donut,3 comments
"Ok, now just come on slowly...",7 hours ago,r/nononono,9 comments
Pesky hedges,2 hours ago,r/DesirePath,comment
Lost and Found,23 hours ago,r/nosleep,118 comments
New Galactic Civilizations III Expansion Coming to a Galaxy Near You! Say Hello to GalCiv III: Intrigue!!!,2 hours ago,r/4Xgaming,2 comments
"Cameron's ""joker"" character on Gotham; Ian on shameless = _ÙÔ_ÙÔ brilliant",6 hours ago,r/shameless,8 comments
Waitress Kanan ~,6 hours ago,r/LoveLive,2 comments
Lets get Bounty0x listed on Cobinhood exchange!,8 hours ago,r/Bounty0x,7 comments
"Dear, netmarble free to play problem.",6 hours ago,r/future_fight,50 comments
Natsuki understands the proletarian struggle,7 hours ago,r/ANI_COMMUNISM,5 comments
Little Philly. 398 Grams of happiness _Ù÷â,7 hours ago,r/Hedgehog,1 comment
Finished Curating My Meteorite! [Pallasite],2 hours ago,r/rockhounds,6 comments
Fiery Mountains,1 hour ago,r/proceduralgeneration,2 comments
My photo from Incheon Shortlisted for r/ITAP Photo Of The Year,18 hours ago,r/korea,52 comments
Why Cities Exist | Wendover Productions [13:03],5 hours ago,r/mealtimevideos,4 comments
Bandmates told me to buy new drums. Bought a Jazzmaster instead.,4 hours ago,r/offset,4 comments
Cayde's caches always make me laugh Tuesday mornings.,1 hour ago,r/LowSodiumDestiny,5 comments
Lets get 5k votes to make pewds see my art,10 hours ago,r/PewdiepieSubmissions,74 comments
In Her Sun Hat,10 hours ago,r/MaryElizabethWinstead,comment
Breakfast so large it barely fit on my plate,3 hours ago,r/1500isplenty,5 comments
[NA] Academy Award Best Picture Nominees have been announced. How do they change box office expectations?,6 hours ago,r/boxoffice,30 comments
Crazy Sexy,6 hours ago,r/sexygirls,2 comments
"Protectobots, Roll to the Rescue!",3 hours ago,r/transformers,4 comments
"""CIV 5 teaches you history",5 hours ago,r/civmemes,1 comment
AMA Request: An uncle who actually works at Nintendo,9 hours ago,r/casualiama,11 comments
After 54% into windows update my screen is black and mouse and keyboard don't work,4 hours ago,r/Windows10,11 comments
"OBS Studio v21 Released: Lua/Python Scripting, New Audio Meters, Ducking, Multiview, and lots more",16 hours ago,r/Twitch,79 comments
Ian lets trans people run trains on him,3 hours ago,r/Cumtown,5 comments
Badass Accord Slammed + tucked,3 hours ago,r/Stance,comment
12 ways to divide Greece.,8 hours ago,r/europe,220 comments
Low Clearance...,9 hours ago,r/nevertellmetheodds,14 comments
The way this cat jumps...,3 hours ago,r/BetterEveryLoop,6 comments
Saros in net tonight vs. Lightning,3 hours ago,r/Predators,17 comments
#windbreaker,8 hours ago,r/FixedGearBicycle,14 comments
G11 [Girls' Frontline],7 hours ago,r/Gunime,2 comments
Lisa for Vogue Korea,9 hours ago,r/BlackPink,3 comments
I like mining the Garlicoin.,9 hours ago,r/garlicoin,34 comments
We Are Detroit. Inaugural commute to work.,7 hours ago,r/bikecommuting,2 comments
"January 23rd, 2018 - /r/HumanReflexes: When the brain takes the wheel.",7 hours ago,r/subredditoftheday,2 comments
[FO] My most time consuming project by far. I‰Ûªm so happy with how this turned out! (Junior was also happy _Ù÷ã),5 hours ago,r/CrossStitch,4 comments
She‰Ûªs in school to be a nurse.,3 hours ago,r/awfuleverything,7 comments
Forbidden Sky - new game in Matt Leacock and Gamewright's cooperative Forbidden series,2 hours ago,r/boardgames,26 comments
"WGA, Emmy, and Peabody award-winning writer Kevin Bleyer (Daily Show, Obama speeches) fired after detailing 24 days of 'toxic and demeaning' behaviour by bosses at Megyn Kelly today",10 hours ago,r/television,114 comments
Checkmate Atheists,3 hours ago,r/im14andthisisdeep,4 comments
McGuire: Don't run Pacioretty out of town (TSN 690),5 hours ago,r/Habs,25 comments
We could keep all those evil corporations in check if only we had the right people in charge!,2 hours ago,r/Shitstatistssay,6 comments
Mattie Larson testifies against Nassar; discusses 2010 Worlds and impact of the Karolyis,2 hours ago,r/Gymnastics,7 comments
Going camping with your friends,12 hours ago,r/Planetside,10 comments
I‰Ûªve Met this nice young fella at the Maldives last week,an hour ago,r/WhaleShark,3 comments
"WAKE YOUR ASSES UP! IT'S FINALLY GAME DAY IN THE FORTRESS AGAIN! TODAY, WE TAKE ON JOHN TORTELLINI AND THE COLUMBUS BLUE JACKETS",5 hours ago,r/goldenknights,15 comments
Coming soon,2 hours ago,r/pyrocynical,1 comment
Snowy Rooftop,5 hours ago,r/Bombing,2 comments
Seen on /r/fuckthealtright,17 hours ago,r/wokekids,42 comments
my wife draw a kaonoshi / no-face that loves pizza,5 hours ago,r/ghibli,comment
Amber Heard,an hour ago,r/goddesses,comment
"I'm extremely skinny and weak, never did anything except swimming, hate physical activity and have a mental block anytime I try to do some exercise. How do I get started?",7 hours ago,r/AskMen,79 comments
"When we're asked ""what when is folkpunk""",2 hours ago,r/FolkPunk,1 comment
Hey guys I was a cavs bandwagon for a couple years... I would like to become a Toronto Raptors fan.,5 hours ago,r/torontoraptors,101 comments
Hahahaha! This is basically telling us women are dumb compared to men. What a shit show!?!?,7 hours ago,r/sjwhate,16 comments
Bodysuit,4 hours ago,r/ElsaHosk,comment
My French Ameer,9 hours ago,r/brockhampton,7 comments
Floridians will vote this fall on restoring voting rights to 1.5 million felons,3 hours ago,r/FLgovernment,1 comment
This is Happening on May 4,3 hours ago,r/LCDSoundsystem,19 comments
My Muse 7‰Û vinyl collection,7 hours ago,r/Muse,6 comments
"If you need a third swing, you need batting practice not more socks.",3 hours ago,r/nocontext,1 comment
[Academy Awards] Jordan Peele's 'Get Out' and Guillermo del Toro's 'The Shape of Water' Nominated for Best Picture!,5 hours ago,r/horror,26 comments
"I got tired of your HD senate, here's a jpeg one.",5 hours ago,r/PrequelMemes,39 comments
Fluff,7 hours ago,r/parrots,3 comments
"Great news, Yotto Debuts his Essential Mix this Saturday on BBC Radio 1! Looking forward to this one.",6 hours ago,r/AboveandBeyond,2 comments
Do you support the 1A challenge to Missouri's abortion law?,8 hours ago,r/AskTrumpSupporters,155 comments
"Leaked: TGIF to announce 100,000 sqft facility",5 hours ago,r/weedstocks,104 comments
I found lilypichu in an anime :),8 hours ago,r/offlineTV,10 comments
Kanna eats tide pod,7 hours ago,r/DragonMaid,3 comments
"Ann-Margret, 1964",3 hours ago,r/ClassicScreenBeauties,comment
YouTube actively promoting Logan Paul,8 hours ago,r/mildlyinfuriating,16 comments
"Bridgehouse, Muskoka, ON, Canada (Llama Urban Design, 2017)[2364x1576]",23 hours ago,r/ArchitecturePorn,15 comments
Connect Four 2 : Electric Boogaloo,4 hours ago,r/IASIP,8 comments
Mixed beans.,5 hours ago,r/jellybeantoes,2 comments
Anyone notice the cool mural in the background of the first episode? I like how they‰Ûªre playing homage to past seasons.,3 hours ago,r/MtvChallenge,13 comments
[Meta] Thank you for politely declining,an hour ago,r/r4r,3 comments
"This spiky chap came on a 100km drive with us under our fuel filler cap, and is possibly quite confused as to where he is",10 hours ago,r/spiderbro,6 comments
"Traditional wooden architecture downtown in the 'Garden City' of Georgetown - Guyana, South America. [misc]",16 hours ago,r/architecture,9 comments
"That's what ""everyone"" means",5 hours ago,r/noshitouija,1 comment
Bill would prohibit abortion when 'sole reason' is Down syndrome | KSL.com,1 hour ago,r/SaltLakeCity,12 comments
Gay_Ù_´irl,19 hours ago,r/gay_irl,14 comments
The newest addition to my household: Eda (my first cat),2 hours ago,r/kittens,5 comments
