title,time,sub,comments
Dad reflexes prevent crash.,2 hours ago,r/DadReflexes,249 comments
Quite literally choosing beggar,4 hours ago,r/ChoosingBeggars,631 comments
When your cat crashes his bicycle in his dream...,4 hours ago,r/funny,642 comments
Heatmap of numbers found at the end of Reddit usernames [OC],5 hours ago,r/dataisbeautiful,2612 comments
Hre you OPEN TODAY,5 hours ago,r/oldpeoplefacebook,313 comments
A tower of giraffes out for a run,5 hours ago,r/interestingasfuck,469 comments
My friend playing Mario Odyssey during class,3 hours ago,r/gaming,409 comments
"2 years of saving $150 a month bought me this (the real OP - yesterday,'s poster took my pic from imgur w/o asking then deleted the post when I told him to leave it)",6 hours ago,r/battlestations,1109 comments
This redwood tree stump is older than the Roman colosseum and other wonders of the world,5 hours ago,r/mildlyinteresting,437 comments
Sartre Day Night Live,6 hours ago,r/standupshots,265 comments
IBM Ball Head typewriter,6 hours ago,r/oddlysatisfying,704 comments
These traffic lights in the Ukraine.,6 hours ago,r/pics,888 comments
"Psychedelic mushrooms reduce authoritarianism and boost nature relatedness, experimental study suggests",6 hours ago,r/science,864 comments
The flaming flip off,4 hours ago,r/instant_regret,248 comments
PsBattle: Prize Winning Cake,6 hours ago,r/photoshopbattles,308 comments
"""I Put Fries in an Enclosed Bowl So They Steam and Get Soggy"" - Some Prick Cook",7 hours ago,r/WeWantPlates,562 comments
Welcome to Metropolis,6 hours ago,r/evilbuildings,141 comments
Legit the best place for your squad to stay woke...,2 hours ago,r/FellowKids,159 comments
One of the best feelings ever,4 hours ago,r/wholesomebpt,98 comments
New 512GB microSD card is the biggest microSD card yet,6 hours ago,r/gadgets,815 comments
Orangutan saves friend from drowning.,8 hours ago,r/gifs,1584 comments
Parking on the ice.,6 hours ago,r/Wellthatsucks,575 comments
Tesla‰Ûªs giant battery in Australia made around $1 million in just a few days,4 hours ago,r/Futurology,192 comments
My girlfriend told me to try Yoga. This is what happens every time.,6 hours ago,r/AnimalsBeingJerks,341 comments
We took a 100 year old cabinet and an old bowling alley lane and made a kitchen island!,6 hours ago,r/DIY,420 comments
Those bathroom tiles...,6 hours ago,r/DiWHY,451 comments
The importance of airbag deployment times,7 hours ago,r/educationalgifs,769 comments
Corgi-Husky Mix. My two favorite breeds in one. It's absolute.......,7 hours ago,r/corgi,326 comments
"It‰Ûªs getting pretty hot, I think I need a popsicle",7 hours ago,r/boottoobig,248 comments
Astronomers observe blue bubble left behind by star shedding its outer layers,7 hours ago,r/space,190 comments
Snoke building instructions after tlj,6 hours ago,r/SequelMemes,125 comments
The old Intel logo makes sense now,7 hours ago,r/ProgrammerHumor,125 comments
The Corruption Cycle,7 hours ago,r/PoliticalHumor,2023 comments
*sad whipcrack*,5 hours ago,r/sadcringe,164 comments
This multi-part youtube tutorial,8 hours ago,r/mildlyinfuriating,263 comments
Buddy sent me this one.,7 hours ago,r/Tinder,220 comments
Greece to legalize Medical Marijuana in February,5 hours ago,r/worldnews,165 comments
Diver suspended in current.,9 hours ago,r/woahdude,998 comments
"TIL almost 1 in 4 people with tattoos regret it, meaning about 7.5 million Americans",8 hours ago,r/todayilearned,8803 comments
Full List of 2018 Oscar Nominations - Updating Live,7 hours ago,r/movies,5926 comments
United in Diversity,5 hours ago,r/polandball,229 comments
Dog getting a blanket,7 hours ago,r/thisismylifenow,102 comments
My girlfriend told me to try Yoga. This is what happens every time.,7 hours ago,r/aww,216 comments
"The Guinness Brewery, Dublin, 1910[1024*718]",5 hours ago,r/HistoryPorn,82 comments
I‰Ûªm always here for you,8 hours ago,r/wholesomememes,500 comments
"Microsoft‰Ûªs Xbox game subscription will include the next Halo, Gears of War, and Forza on launch day",6 hours ago,r/xboxone,1067 comments
Just hopped into the shop,4 hours ago,r/Justrolledintotheshop,79 comments
Visual Effects being Rendered in Real-Time,9 hours ago,r/videos,756 comments
WWI veteran is compared to his pre-war passport photo (circa 1918 - colourised),3 hours ago,r/fakehistoryporn,44 comments
Trying to pacifist run SuperHot is insane.,6 hours ago,r/gaming,1610 comments
The Abandoned Swimming Pool at the University of Rochester [2720x1811] -- the footprints really help make the picture too.,8 hours ago,r/AbandonedPorn,455 comments
[Image] It's not the end yet.,3 hours ago,r/GetMotivated,87 comments
At the age of 13,7 hours ago,r/ihavesex,133 comments
This graphic design company sabotaged themselves from the very start with one of the worst logos of all time.,8 hours ago,r/CrappyDesign,266 comments
My crab wants to say hello to this sub,4 hours ago,r/StoppedWorking,122 comments
Totally..fooled me.,8 hours ago,r/BetterEveryLoop,223 comments
Black magic,9 hours ago,r/blackpeoplegifs,252 comments
Oof,8 hours ago,r/dankchristianmemes,146 comments
Nutt Milk,9 hours ago,r/Pareidolia,208 comments
sir richard hammondborough,9 hours ago,r/TopGear,120 comments
Trapdoor Spider,7 hours ago,r/natureismetal,329 comments
"Yggbrosil, the Fractal Swole Tree",9 hours ago,r/Bossfight,147 comments
19-year-old terrorist who told CNN 'I'm coming to gun you all down',5 hours ago,r/beholdthemasterrace,626 comments
DeMoN SpAwn EnSlaVES GooD BoYE FoR EterNity,8 hours ago,r/PeopleFuckingDying,68 comments
Kitty...kangaroo kicks.,8 hours ago,r/AnimalsBeingDerps,195 comments
Stuffed French Toast Loaf,5 hours ago,r/GifRecipes,190 comments
"""I burn bibles and quarans by the way :)""",7 hours ago,r/iamverybadass,378 comments
Speed reading,6 hours ago,r/WatchandLearn,129 comments
Cat in the hat,7 hours ago,r/CatTaps,67 comments
M 8.0 earthquake in Alaska,10 hours ago,r/news,4460 comments
Bending metal rods with precision.,8 hours ago,r/mechanical_gifs,102 comments
And he even thinks he is on the right side,9 hours ago,r/StrangerThings,140 comments
"In 1974, 22-year-old Daniel Sorine trained his camera on two mime artists performing in New York‰Ûªs Central Park. In 2013, Daniel was looking through his negatives and photographs when he realised one of the mimes was Oscar winning actor Robin Williams",9 hours ago,r/OldSchoolCool,847 comments
How it went down,4 hours ago,r/MURICA,55 comments
Are you familiar with the sucky panther?,6 hours ago,r/ATBGE,155 comments
Tea,7 hours ago,r/whitepeoplegifs,76 comments
You can tell a lot about someone by whether they read HP as horsepower or hit points.,3 hours ago,r/Showerthoughts,402 comments
An old abandoned road slowly healing over and being reclaimed by nature.,8 hours ago,r/pics,2211 comments
"I got tired of your 144p senates, here's an HD senate",10 hours ago,r/PrequelMemes,316 comments
How to invest properly,8 hours ago,r/MemeEconomy,68 comments
Dogtor Research,5 hours ago,r/behindthegifs,42 comments
My reaction every time I scroll through HQG,6 hours ago,r/HighQualityGifs,30 comments
"Redditors who grew up with overly permissive parents, what was the most absurd thing you were allowed to do?",10 hours ago,r/AskReddit,6296 comments
KenM on Hitler,8 hours ago,r/KenM,56 comments
Shadow Art,9 hours ago,r/BeAmazed,42 comments
"Yeah, I think that's right.",7 hours ago,r/OSHA,159 comments
Netflix once loved talking about net neutrality - so why has it suddenly gone quiet?,9 hours ago,r/technology,1060 comments
Six day old elephant learning to use it's trunk.,8 hours ago,r/babyelephantgifs,70 comments
me irl,10 hours ago,r/meirl,79 comments
[Poetry] healing in video games,5 hours ago,r/youtubehaiku,75 comments
Hmmm,4 hours ago,r/facepalm,29 comments
His name is Buddha!,8 hours ago,r/aww,955 comments
Sessions Is Interviewed in Mueller's Russia Investigation,5 hours ago,r/The_Mueller,197 comments
Earth doesn't need me!,8 hours ago,r/niceguys,285 comments
Saving a fish,8 hours ago,r/HumansBeingBros,52 comments
When you don't read the job description when choosing your career...,6 hours ago,r/CringeAnarchy,370 comments
"I <3 this sub, so I made an illustration inspired by some of your fits _Ù¡_ÙÓ´",11 hours ago,r/streetwear,274 comments
Resume cheat sheet,4 hours ago,r/coolguides,55 comments
How to become a mod at /r/iamverysmart,4 hours ago,r/disneyvacation,34 comments
Guy doesn't realise mods can still see removed posts,8 hours ago,r/quityourbullshit,198 comments
Don't be happy. Worry.,10 hours ago,r/dontdeadopeninside,61 comments
Princess... where's my Master Sword?!,7 hours ago,r/zelda,87 comments
"Poseidon by Kelly at Parliament Tattoo, Finsbury Park",5 hours ago,r/tattoos,39 comments
Dad prevents crash.,2 hours ago,r/gifs,141 comments
South America loves Donna.,5 hours ago,r/PandR,32 comments
Fí êÄíÛêÕíÈê_ê_aíÄíãê¤êÛíÑí´íÇíÊsíÄê¬í_íí í¬í_êÓêöê¥eíöê_íâíÓí_í êÇêÊí¦êÁíÙêÒí£íBucc,10 hours ago,r/surrealmemes,157 comments
Orangutan saves friend from drowning.,5 hours ago,r/likeus,49 comments
Waiting for some cupcakes to finish baking? Put some music on for Natsuki to enjoy!,6 hours ago,r/DDLC,124 comments
He got the order wrong,11 hours ago,r/Jokes,337 comments
treat me like a king,7 hours ago,r/indianpeoplefacebook,64 comments
Guardians of the Galaxy Vol. 2 scores Academy Award nomination for Best Visual Effects,6 hours ago,r/marvelstudios,225 comments
20 mins into Looney Toons and Chill he gives you that look,7 hours ago,r/IASIP,65 comments
Cozy little town in Romania,8 hours ago,r/CozyPlaces,74 comments
The way this cat jumps,11 hours ago,r/WhyWereTheyFilming,185 comments
Unleash the Kraken,8 hours ago,r/BlackPeopleTwitter,154 comments
Special Election TODAY in Pennsylvania - Support Austin Davis for State House,6 hours ago,r/BlueMidterm2018,30 comments
A Dozen Ways To Divide The United Kingdom,12 hours ago,r/europe,1248 comments
"EXCUSE YOU,YOURE HURTING HIS FEELINGS",7 hours ago,r/Breath_of_the_Wild,80 comments
Mechanical Bunny Force by Ren Wei Pan,9 hours ago,r/ImaginaryTechnology,69 comments
Pinterest is like a virus that infected the google image search.,10 hours ago,r/Showerthoughts,1897 comments
So it snowed on the cabbage field...,4 hours ago,r/pics,146 comments
ITAP of embers on a cold day in Sweden,10 hours ago,r/itookapicture,60 comments
Shooting at Marshall County High School,5 hours ago,r/news,1915 comments
Drive It Like You Stole It,3 hours ago,r/comics,14 comments
Sorry huh?,11 hours ago,r/trashy,299 comments
Lirik personally bans GreekGodx as he joins his chat,an hour ago,r/LivestreamFail,676 comments
How to make Miramar better,8 hours ago,r/PUBATTLEGROUNDS,524 comments
OOF!,13 hours ago,r/BikiniBottomTwitter,113 comments
"Saw this on Comment Awards, thought I‰Ûªd share it with y‰Ûªall _Ù÷â",8 hours ago,r/teenagers,50 comments
Femanon wants his meat.,13 hours ago,r/greentext,230 comments
Buffalo Chicken Dip Stuffed Bread. Gotta prepare for the Super Bowl! Recipe in comments. [OC] [670 x 1012],5 hours ago,r/FoodPorn,37 comments
"MRW the recent hire at work suggests I give him my weekends off because he ""has a life""",14 hours ago,r/reactiongifs,666 comments
2meirl4meirl,13 hours ago,r/2meirl4meirl,274 comments
Oh god...,7 hours ago,r/ComedyCemetery,98 comments
Battery bite test: wCGW?,13 hours ago,r/Whatcouldgowrong,464 comments
The call of the wild!,14 hours ago,r/Eyebleach,117 comments
The boy and I at Machu Picchu earlier this year. What an amazing trip _ÙÔ¬‰Û‰_•ü‰Û_ÙÔ¬‰Ý¡_Ù_•ü‰Û_ÙÎö,6 hours ago,r/lgbt,37 comments
Final round!!! No bamboozle! +80upvotes and I release today the first garlicoin song! Tasty waves!! Just upvote and feel the bakery music!,7 hours ago,r/garlicoin,84 comments
Hot Rolled Steel Getting Sprayed,13 hours ago,r/nonononoyes,567 comments
Humans are terrifying,11 hours ago,r/tumblr,151 comments
Today is Benson's birthday!,6 hours ago,r/funhaus,36 comments
Disney's Talespin,7 hours ago,r/nostalgia,103 comments
DuckDuckGo adds tracker blocking to help curb the wider surveillance web,8 hours ago,r/privacy,101 comments
It‰Ûªs us vs them.,14 hours ago,r/WhitePeopleTwitter,264 comments
South Park _Ù´__Ù´__Ù´__Ù´_ by Aleksandar Savic,8 hours ago,r/southpark,32 comments
Synced videos of the Eagles fan running into the pillar,28 minutes ago,r/sports,28 comments
TIL: Sacha Baron Cohen offered to pay fines for six Czech tourists who were arrested in Kazakhstan for wearing nothing but 'Borat' inspired mankinis.,7 hours ago,r/todayilearned,63 comments
Wild wolf found in Belgium for first time in more than 100 years,7 hours ago,r/worldnews,162 comments
"Four female pilots leaving their ship, Pistol Packin' Mama, at the four engine school at Lockbourne AAF. They are members of a group of Women Airforce Service Pilots who have been trained to ferry the B-17 Flying Fortresses. World War II, 1944.",2 hours ago,r/ColorizedHistory,15 comments
Korra Cosplay by ArtemisMoon,6 hours ago,r/TheLastAirbender,21 comments
80's kids started programming at an earlier age than today's millennials,7 hours ago,r/programming,641 comments
Thought I Was Playing PUBG On Xbox,11 hours ago,r/FortNiteBR,199 comments
Brake-checker/insurance scammer gets a bit of rough trucker justice,10 hours ago,r/JusticeServed,398 comments
Shocking prison secrets that no-one tells you.,12 hours ago,r/funny,1467 comments
Ian‰Ûªs Twitter account is what helps me get through the work day without killing myself.,3 hours ago,r/Idubbbz,17 comments
_ÙÉ_•üfuck _Ù÷__Ù÷_,13 hours ago,r/DeepFriedMemes,85 comments
"Atticus was left in a box in a field by his original owner, but he's all smiles now!",6 hours ago,r/PuppySmiles,22 comments
Miami Vice,4 hours ago,r/outrun,15 comments
Aussie mud map,5 hours ago,r/nevertellmetheodds,15 comments
Harambe is a troll,8 hours ago,r/4PanelCringe,43 comments
Girlfriend opened the Rabbits cage and sent me this.,8 hours ago,r/aww,124 comments
Bananabob Crescentpants,11 hours ago,r/crappyoffbrands,122 comments
Baby is dad's biggest fan.,7 hours ago,r/gifs,148 comments
Family Photo,11 hours ago,r/PerfectTiming,56 comments
"Come with me, it is the only way.",2 hours ago,r/StarWars,45 comments
Seeking refuge from Sequel Memes,7 hours ago,r/PrequelMemes,104 comments
Critically endangered Sumatran tiger cubs arrive at Maharajah,6 hours ago,r/babybigcatgifs,9 comments
Tsunami warning on entire B.C. coast after large earthquake southeast of Alaska,10 hours ago,r/canada,228 comments
"A dip in the ocean, 1920s?",5 hours ago,r/TheWayWeWere,36 comments
Uhh...what? The quest to learn a new language continues.,7 hours ago,r/creepyPMs,114 comments
Locks of Love,5 hours ago,r/trippinthroughtime,9 comments
"The $100,000 Dodge Demon Is the Craziest Muscle Car Ever - Doug DeMuro",3 hours ago,r/cars,305 comments
No one will get through here boss!,2 hours ago,r/NotMyJob,12 comments
"[REPOSTED WITH PROOF] I recently made a post about dermatographism in which I can write on my skin, AMA",5 hours ago,r/IAmA,287 comments
redemption arc,4 hours ago,r/comedynecromancy,39 comments
"Trump Just Announced a Plan that Could Cripple the Solar Industry. Trump is slapping a 30 percent tariff on imported panels, a move that experts say is poised to hurt an industry that has seen its costs drop dramatically the past decade largely because of cheap imports from China.",7 hours ago,r/MarchForScience,226 comments
"[WP] Alien invaders entire our Solar System. As the armies of the world panic or ready for war, the continent of Australia simply takes off on engines and flies off to meet them.",10 hours ago,r/WritingPrompts,125 comments
A glorious sight,3 hours ago,r/eagles,76 comments
woof_ÙÎÀirl,8 hours ago,r/woof_irl,12 comments
"LPT: In the event of an incoming tsunami, go to sleep on an air mattress. If the tsunami hits, you will wake up safely on a raft.",8 hours ago,r/ShittyLifeProTips,35 comments
"""Animals"" was released this day, 41 years ago",8 hours ago,r/pinkfloyd,101 comments
"""After the match"". Oil on cardboard, 40x30, 2018. Anthony Fletcher",15 hours ago,r/Art,603 comments
"Just finished reading the Hobbit to my 6 year old, it was magical",14 hours ago,r/books,1183 comments
Glamour Shot Blunder (7 years old),2 hours ago,r/blunderyears,42 comments
Cant wait for the next Olympics gifs,16 hours ago,r/gifsthatkeepongiving,448 comments
Thank you SHG! So much. -Everyone,3 hours ago,r/WWII,68 comments
A unlucky youngling trying to find the nonexistent heartbeat of a terrorist,13 hours ago,r/EmpireDidNothingWrong,81 comments
Me and this fun Asian guy met Keanu on a plane.,5 hours ago,r/KeanuBeingAwesome,78 comments
The eyerony.... [Skyrim],6 hours ago,r/gaming,146 comments
Baby cow brushies back _ÙÔÉ,7 hours ago,r/brushybrushy,18 comments
Lego trench i made!,11 hours ago,r/lego,71 comments
This makeup.,12 hours ago,r/blackmagicfuckery,84 comments
My buddy and I have a bit of Synergy.,5 hours ago,r/HitBoxPorn,27 comments
This is not going to go the way you think.,6 hours ago,r/bertstrips,14 comments
Nintendo's very first office in Kyoto in 1889,3 hours ago,r/nintendo,23 comments
Trapdoor Spider is _ÙÓ´_ÙÓ´_ÙÓ´,16 hours ago,r/NatureIsFuckingLit,1143 comments
The ‰ÛÏI dont watch or play Pokemon but I love it‰Û starter pack‰Û,6 hours ago,r/starterpacks,105 comments
Absolutely fabulous snowy owl,7 hours ago,r/Superbowl,9 comments
My tactic for next year's US tax season,4 hours ago,r/CryptoCurrency,109 comments
I love my backyard :),11 hours ago,r/skateboarding,155 comments
Leefs Inspector,4 hours ago,r/ilikthebred,17 comments
"Woman facing homelessness wins $25,000/year for life in the lottery",5 hours ago,r/UpliftingNews,121 comments
It‰Ûªs Time to Stop Buying Phones from OnePlus,4 hours ago,r/Android,398 comments
Cat.,5 hours ago,r/CatsStandingUp,29 comments
It's the thought that counts,4 hours ago,r/BlackPeopleTwitter,32 comments
"So uh, seeing the smug edit of Ninian somewhere, it sorta inspired me to create this",4 hours ago,r/FireEmblemHeroes,42 comments
"I have a condition called dermatographism, where I can ‰Û÷write‰Ûª on my skin and it appears as a rash",13 hours ago,r/mildlyinteresting,2899 comments
Downtown Houston this morning,5 hours ago,r/houston,31 comments
"Over 11,000 upvotes on /r/the_donald..",6 hours ago,r/forwardsfromgrandma,82 comments
Hawaii's governor couldn't correct the false missile alert sooner because he forgot his Twitter password,6 hours ago,r/news,243 comments
To run across the road.,2 hours ago,r/therewasanattempt,32 comments
Drop-Off Blood Bins,15 hours ago,r/AteTheOnion,153 comments
Jonny Gets An Oscar Nomination!!!!!!,6 hours ago,r/radiohead,71 comments
"I negotiated salary for the first time ever, and I got what I wanted!",15 hours ago,r/personalfinance,867 comments
I saw Creed tonight! 74 and still an amazing performer,16 hours ago,r/DunderMifflin,262 comments
A sign outside of a local pub. Need to get those early morning drinkers in,11 hours ago,r/CasualUK,212 comments
Wut,7 hours ago,r/softwaregore,44 comments
My first art for KSP,7 hours ago,r/KerbalSpaceProgram,42 comments
Someone gets it,15 hours ago,r/LateStageCapitalism,1135 comments
Rathalos Skull,5 hours ago,r/MonsterHunter,37 comments
"Annotated aerial photo of Boston, Massachusetts and environs, 1930. [2854ÌÑ2202]",7 hours ago,r/MapPorn,38 comments
"The Jagged Edge of Lake Superior. Silver Bay, MN. [1958x2448][OC]",17 hours ago,r/EarthPorn,625 comments
Baby rhinos playing together,5 hours ago,r/Zoomies,20 comments
Where did this Trump go?,4 hours ago,r/Libertarian,99 comments
Oil painting by Aronja-Art,4 hours ago,r/horizon,15 comments
my busy puppy,11 hours ago,r/dogswithjobs,22 comments
"Neil Diamond Diagnosed with Parkinson's Disease, Announces Retirement",17 hours ago,r/Music,606 comments
Camels disqualified from Saudi beauty contest over Botox,15 hours ago,r/nottheonion,136 comments
This surfing dock,7 hours ago,r/interestingasfuck,62 comments
First color view of Earth seen from the Moon photographed by a human [5700x5800],9 hours ago,r/spaceporn,45 comments
"3 LSU students arrested for trespassing, burglary in Tiger Stadium; caught with ""twelve LSU collector's cups""",6 hours ago,r/CFB,336 comments
Drone that flies like a bird,an hour ago,r/INEEEEDIT,32 comments
Like most people my age...,7 hours ago,r/dadjokes,35 comments
Netflix's Altered Carbon is Blade Runner meets Demolition Man,11 hours ago,r/television,277 comments
"Jags fan just wanting to say ""Thank you""",7 hours ago,r/Patriots,178 comments
This is the swimming hole from my home town in Texas. It's the mouth of an underwater cave system that still holds the unrecovered bodies of divers.,2 hours ago,r/thalassophobia,38 comments
absolutelynotme_irl,13 hours ago,r/absolutelynotme_irl,11 comments
"Your daily bit of motivation, thanks to my girlfriend [Sonic '06: WHAT IS THIS? - PART 20]",5 hours ago,r/gamegrumps,23 comments
My co-worker‰Ûªs dog does a blop.,5 hours ago,r/blop,11 comments
"Casa GG Tapalpa, Mexico [851x566]",7 hours ago,r/RoomPorn,24 comments
Grove Street,4 hours ago,r/CitiesSkylines,55 comments
"US women pay an average $1,000 in medical bills after being raped. 'This financial burden adds to the emotional burden of sexual assault,' says lead author Ashley Tennessee",2 hours ago,r/TwoXChromosomes,38 comments
Low Clearance...,18 hours ago,r/Unexpected,662 comments
Equality!,3 hours ago,r/facepalm,73 comments
or the clairvoyance to conjured up the stolen data tapes...,6 hours ago,r/OTMemes,15 comments
Hey fren,18 hours ago,r/rarepuppers,470 comments
Truly heartwarming,4 hours ago,r/trebuchetmemes,15 comments
Kennedy‰Ûªs not holding shit back... oh at all,3 hours ago,r/rupaulsdragrace,129 comments
CIV 5 be like,17 hours ago,r/HistoryMemes,161 comments
"Tesla Quietly Sold 200,000th Model S Last Year",8 hours ago,r/teslamotors,63 comments
"Update: Hulu confirms that they have been told April is when new episodes of Steven Universe ""will begin airing""",6 hours ago,r/stevenuniverse,149 comments
"White Fright: Divided Britain (2018) ‰ÛÓ In 2007 Panorama made a programme in Blackburn, which was becoming segregated along ethnic and religious lines. Now Panorama has returned and found a town that is even more divided.",6 hours ago,r/Documentaries,681 comments
Sat in the Wetherspoons on the weekend and watched an old guy hurriedly fill a wine glass halfway with squeezy mayonnaise. He then proceeded to dip his fingers in it and polish it all off before his wife got back from the toilets.,12 hours ago,r/britishproblems,232 comments
The humanity!,4 hours ago,r/madlads,6 comments
The Ol' Reliable,10 hours ago,r/Gamingcirclejerk,36 comments
Finally finished my big ol' Julian Plush! Sparkle~!,4 hours ago,r/AnimalCrossing,37 comments
"GOP relies on Russian bots to falsely smear Democrats during shutdown fight - More and more, Republicans are looking to foreign operatives to push the party's domestic messaging.",5 hours ago,r/NewPatriotism,79 comments
"Epic, thank you for allowing us to buy exactly what we want and not put cosmetics behind RNG lootboxes",7 hours ago,r/FortNiteBR,321 comments
Slow motion of a molten lead droplet hitting water.,14 hours ago,r/chemicalreactiongifs,59 comments
What are you happily addicted to?,6 hours ago,r/AskReddit,2134 comments
Doggo doesnt like getting wet ears,13 hours ago,r/dogpictures,30 comments
Every new crypto investor!,12 hours ago,r/Bitcoin,192 comments
I don't need a lady's opinion,6 hours ago,r/thatHappened,63 comments
#Bellator192 averaged 770k viewers on Paramount #UFC220 prelims averaged 905k viewers. #Bellator #UFC,5 hours ago,r/MMA,159 comments
When you reboot Windows but it freezes,3 hours ago,r/2healthbars,5 comments
"Apple to Release New Entry-Level 13-inch MacBook This Year, Likely Replacing MacBook Air",11 hours ago,r/apple,675 comments
"Water bending, fire bending, wire bending....(spotted at my school)",7 hours ago,r/techsupportgore,47 comments
This charger gets it.,4 hours ago,r/firstworldanarchists,7 comments
Pewdiepie is such a savage,13 hours ago,r/PewdiepieSubmissions,93 comments
Update to: Someone is threatening to release nude photos of me that were taken when I was underage and I'm terrified that I'll lose my job and be arrested for what is essentially child porn (Ohio),17 hours ago,r/legaladvice,2 comments
"Good morning, I am floof",7 hours ago,r/BabyCorgis,7 comments
hmmm,17 hours ago,r/hmmm,208 comments
"I am practicing gouache... So of course, I painted a little fox!",3 hours ago,r/foxes,11 comments
A husband and wife were grocery shopping ...,7 hours ago,r/Jokes,76 comments
When you are just too good at hide and seek,11 hours ago,r/funny,67 comments
"Mkhi: ""I will always cherish the memory of that moment and that match. And of my Boxing Day scorpion kick and of hearing the song ‰ÛÏWhoa Mkhitaryan...‰Û every time I stepped onto the pitch. I could name many more memories, I enjoyed every moment we shared and cheered together.",10 hours ago,r/reddevils,60 comments
Red Velvet - Bad Boy (Teaser Images #1),5 hours ago,r/kpop,129 comments
"6 weeks ago, I was going on 2.5 months unemployed and was seriously considering suicide. Today, I have a job that I can't wait to go to each day and I've been killing it with my weight loss. I'm so happy after a warm shower to finish the day off!",17 hours ago,r/happy,445 comments
Quality time,3 hours ago,r/AccidentalRenaissance,27 comments
Fierce kitty with a gentle meow,8 hours ago,r/aww,222 comments
Wet and foggy two days in a row here in Central PA. Pure bliss,6 hours ago,r/raining,15 comments
